{
  "@context": [
    "https://www.w3.org/ns/credentials/v2",
    "https://rightsroot.org/spec/prm/ns/v1"
  ],
  "type": [
    "VerifiableCredential",
    "PRMNotice"
  ],
  "policyChainId": "urn:prm:chain:uEiDvRgzy0aV11g-h-BuMD9gbYTrA3EP7eKrFyeOeyn_VGw",
  "policyDigest": "uEiCCVYqo5goptwm4lS1RN_8WgOwJ5A8un4JTasreIyS9JA",
  "policyByteDigest": "uEiCKt6706NwzOf5Som7k6H20_z_DEh6Gwq8rH-IhM8yEeQ",
  "policyVersion": 1,
  "policyUrl": "https://rightsroot.com/u/user0001",
  "issuer": {
    "id": "prm:s2nfbcv7jr5kcf3yopfs5dlrqa",
    "did": "did:key:z6MkfCwPTWq3SKbw4AVj7j8t8oFBiFp6CvZiTnXAw24nVkLH",
    "keyEventLog": "https://rightsroot.com/u/user0001/kel.json",
    "keyEventHash": "uEiCWmlCKv0x6oRd4c8sujXGAHMGIESmnmHdAh7hr4bFZcQ"
  },
  "recipient": {
    "name": "City of Whittier Police Department",
    "type": "law-enforcement",
    "department": "Records Division",
    "domain": "whittierpd.org",
    "contact": "records@whittierpd.org",
    "postalAddress": "13200 Penn St\nWhittier, CA 90602",
    "jurisdiction": "US-CA"
  },
  "purpose": "To place my standing personal data policy on record with the recipient.",
  "issued": "2026-09-16T16:00:00Z",
  "matchingIdentifiers": [
    {
      "namespace": "us-license-plate",
      "value": "US-CA-0EXAMPLE",
      "salt": "qMNe3DAjqBbp0fBQzvWTJw"
    }
  ],
  "requestedTreatment": "Please associate this Personal Rights Management policy with records reasonably identifiable as relating to me and honor the stated instructions and objections to the extent permitted by applicable law, policy, contract, and technical capability.",
  "legalEffect": "Personal Rights Management records my standing instructions, authorizations, and objections concerning downstream processing of personal information associated with me. This notice does not independently create legal rights or obligations where none otherwise exist, and nothing in it overrides a valid court order, statutory mandate, or other controlling legal authority.\n\nIf any portion of this policy cannot or will not be honored, this notice should still be treated as a record of my express position and non-consent regarding those downstream uses.",
  "proof": {
    "type": "DataIntegrityProof",
    "cryptosuite": "eddsa-jcs-2022",
    "created": "2026-09-16T16:00:00Z",
    "verificationMethod": "did:key:z6MkfCwPTWq3SKbw4AVj7j8t8oFBiFp6CvZiTnXAw24nVkLH#z6MkfCwPTWq3SKbw4AVj7j8t8oFBiFp6CvZiTnXAw24nVkLH",
    "proofPurpose": "assertionMethod",
    "proofValue": "zyd8ikNvfNrXgHEhhmehd635XtLTokRLRQC82mTmccJyCBCQGEhdx1dPAFCxmEtZkGbpaAYpUe73bwuaBJqr8R6e"
  },
  "id": "urn:prm:notice:uEiC5IVcL4rLIEItGi5JPCBeTyfp__1e7h9yL3Z_vJO3tRg"
}